{
 "schema_version": "1.0",
 "rfam_acc": "RF00167",
 "seq_name": "9nbh_1_C_C",
 "description": "full records of every BGSU loop with at least one nucleotide in this chain (from loops.json; inter-chain loops included)",
 "loops": [
  {
   "loop_id": "HL_9NBH_003",
   "pdb_id": "9nbh",
   "loop_type": "HL",
   "loop_url": "https://rna.bgsu.edu/rna3dhub/loops/view/HL_9NBH_003",
   "atlas_status": "problematic",
   "motif_group": null,
   "motif_group_url": null,
   "motif_group_assignment": null,
   "motif_group_via_loop_id": null,
   "annotation_text": "GNRA",
   "problem": "poor quality numbers",
   "location": null,
   "n_nucleotides": 6,
   "chains": [
    {
     "auth_asym_id": "C",
     "label_asym_id": "C",
     "seq_name": "9nbh_1_C_C",
     "entity_id": 1,
     "in_family": true
    }
   ],
   "multi_chain": false,
   "instances": [
    "9nbh_1_C_C"
   ],
   "strands": [
    {
     "auth_asym_id": "C",
     "start_unit_id": "9NBH|1|C|C|110",
     "end_unit_id": "9NBH|1|C|G|115",
     "nucleotide_indices": [
      0,
      5
     ],
     "n_nucleotides": 6
    }
   ],
   "nucleotides": [
    {
     "seq_name": "9nbh_1_C_C",
     "pdb_id": "9nbh",
     "entity_id": 1,
     "label_asym_id": "C",
     "auth_asym_id": "C",
     "label_seq_id": 110,
     "author_residue_number": 110,
     "insertion_code": "",
     "residue_name": "C",
     "alignment_state": "match",
     "rfam_consensus_pos": 99,
     "pp_char": "*",
     "pp_value": 0.975,
     "pp_category": "high",
     "has_coordinates": true,
     "mapping_status": "mapped",
     "source_identifier": "9NBH|1|C|C|110",
     "unit_id": "9NBH|1|C|C|110",
     "resolution": "resolved"
    },
    {
     "seq_name": "9nbh_1_C_C",
     "pdb_id": "9nbh",
     "entity_id": 1,
     "label_asym_id": "C",
     "auth_asym_id": "C",
     "label_seq_id": 111,
     "author_residue_number": 111,
     "insertion_code": "",
     "residue_name": "G",
     "alignment_state": "match",
     "rfam_consensus_pos": 100,
     "pp_char": "*",
     "pp_value": 0.975,
     "pp_category": "high",
     "has_coordinates": true,
     "mapping_status": "mapped",
     "source_identifier": "9NBH|1|C|G|111",
     "unit_id": "9NBH|1|C|G|111",
     "resolution": "resolved"
    },
    {
     "seq_name": "9nbh_1_C_C",
     "pdb_id": "9nbh",
     "entity_id": 1,
     "label_asym_id": "C",
     "auth_asym_id": "C",
     "label_seq_id": 112,
     "author_residue_number": 112,
     "insertion_code": "",
     "residue_name": "A",
     "alignment_state": "match",
     "rfam_consensus_pos": 101,
     "pp_char": "*",
     "pp_value": 0.975,
     "pp_category": "high",
     "has_coordinates": true,
     "mapping_status": "mapped",
     "source_identifier": "9NBH|1|C|A|112",
     "unit_id": "9NBH|1|C|A|112",
     "resolution": "resolved"
    },
    {
     "seq_name": "9nbh_1_C_C",
     "pdb_id": "9nbh",
     "entity_id": 1,
     "label_asym_id": "C",
     "auth_asym_id": "C",
     "label_seq_id": 113,
     "author_residue_number": 113,
     "insertion_code": "",
     "residue_name": "A",
     "alignment_state": "match",
     "rfam_consensus_pos": 102,
     "pp_char": "*",
     "pp_value": 0.975,
     "pp_category": "high",
     "has_coordinates": true,
     "mapping_status": "mapped",
     "source_identifier": "9NBH|1|C|A|113",
     "unit_id": "9NBH|1|C|A|113",
     "resolution": "resolved"
    },
    {
     "seq_name": "9nbh_1_C_C",
     "pdb_id": "9nbh",
     "entity_id": 1,
     "label_asym_id": "C",
     "auth_asym_id": "C",
     "label_seq_id": 114,
     "author_residue_number": 114,
     "insertion_code": "",
     "residue_name": "A",
     "alignment_state": "not_submitted_flank",
     "rfam_consensus_pos": null,
     "pp_char": "",
     "pp_value": null,
     "pp_category": null,
     "has_coordinates": true,
     "mapping_status": "outside_mapped_region",
     "source_identifier": "9NBH|1|C|A|114",
     "unit_id": "9NBH|1|C|A|114",
     "resolution": "resolved"
    },
    {
     "seq_name": "9nbh_1_C_C",
     "pdb_id": "9nbh",
     "entity_id": 1,
     "label_asym_id": "C",
     "auth_asym_id": "C",
     "label_seq_id": 115,
     "author_residue_number": 115,
     "insertion_code": "",
     "residue_name": "G",
     "alignment_state": "not_submitted_flank",
     "rfam_consensus_pos": null,
     "pp_char": "",
     "pp_value": null,
     "pp_category": null,
     "has_coordinates": true,
     "mapping_status": "outside_mapped_region",
     "source_identifier": "9NBH|1|C|G|115",
     "unit_id": "9NBH|1|C|G|115",
     "resolution": "resolved"
    }
   ],
   "consensus_positions": [
    99,
    100,
    101,
    102
   ],
   "mapping_status_counts": {
    "mapped": 4,
    "outside_mapped_region": 2
   },
   "pp_category_counts": {
    "high": 4
   },
   "source": {
    "loops_url": "https://rna.bgsu.edu/rna3dhub/loops/download/9NBH",
    "motifs_url": "https://rna.bgsu.edu/rna3dhub/pdb/9NBH/motifs",
    "retrieved": "2026-10-15",
    "motif_atlas_release": "4.15"
   },
   "decomposition": {
    "role": "single",
    "merged_from": [],
    "superseded_by": [],
    "counted_in_tracks": true
   }
  },
  {
   "loop_id": "IL_9NBH_003",
   "pdb_id": "9nbh",
   "loop_type": "IL",
   "loop_url": "https://rna.bgsu.edu/rna3dhub/loops/view/IL_9NBH_003",
   "atlas_status": "problematic",
   "motif_group": null,
   "motif_group_url": null,
   "motif_group_assignment": null,
   "motif_group_via_loop_id": null,
   "annotation_text": null,
   "problem": "poor quality numbers",
   "location": null,
   "n_nucleotides": 8,
   "chains": [
    {
     "auth_asym_id": "A",
     "label_asym_id": "A",
     "seq_name": "9nbh_1_A_A",
     "entity_id": 1,
     "in_family": true
    },
    {
     "auth_asym_id": "C",
     "label_asym_id": "C",
     "seq_name": "9nbh_1_C_C",
     "entity_id": 1,
     "in_family": true
    }
   ],
   "multi_chain": true,
   "instances": [
    "9nbh_1_A_A",
    "9nbh_1_C_C"
   ],
   "strands": [
    {
     "auth_asym_id": "A",
     "start_unit_id": "9NBH|1|A|U|141||A",
     "end_unit_id": "9NBH|1|A|A|144||A",
     "nucleotide_indices": [
      0,
      3
     ],
     "n_nucleotides": 4
    },
    {
     "auth_asym_id": "C",
     "start_unit_id": "9NBH|1|C|U|141||A",
     "end_unit_id": "9NBH|1|C|A|144||A",
     "nucleotide_indices": [
      4,
      7
     ],
     "n_nucleotides": 4
    }
   ],
   "nucleotides": [
    {
     "seq_name": "9nbh_1_A_A",
     "pdb_id": "9nbh",
     "entity_id": 1,
     "label_asym_id": "A",
     "auth_asym_id": "A",
     "label_seq_id": 141,
     "author_residue_number": 141,
     "insertion_code": "",
     "residue_name": "U",
     "alignment_state": "not_submitted_flank",
     "rfam_consensus_pos": null,
     "pp_char": "",
     "pp_value": null,
     "pp_category": null,
     "has_coordinates": true,
     "mapping_status": "outside_mapped_region",
     "source_identifier": "9NBH|1|A|U|141||A",
     "unit_id": "9NBH|1|A|U|141||A",
     "resolution": "resolved"
    },
    {
     "seq_name": "9nbh_1_A_A",
     "pdb_id": "9nbh",
     "entity_id": 1,
     "label_asym_id": "A",
     "auth_asym_id": "A",
     "label_seq_id": 142,
     "author_residue_number": 142,
     "insertion_code": "",
     "residue_name": "G",
     "alignment_state": "not_submitted_flank",
     "rfam_consensus_pos": null,
     "pp_char": "",
     "pp_value": null,
     "pp_category": null,
     "has_coordinates": true,
     "mapping_status": "outside_mapped_region",
     "source_identifier": "9NBH|1|A|G|142||A",
     "unit_id": "9NBH|1|A|G|142||A",
     "resolution": "resolved"
    },
    {
     "seq_name": "9nbh_1_A_A",
     "pdb_id": "9nbh",
     "entity_id": 1,
     "label_asym_id": "A",
     "auth_asym_id": "A",
     "label_seq_id": 143,
     "author_residue_number": 143,
     "insertion_code": "",
     "residue_name": "A",
     "alignment_state": "not_submitted_flank",
     "rfam_consensus_pos": null,
     "pp_char": "",
     "pp_value": null,
     "pp_category": null,
     "has_coordinates": true,
     "mapping_status": "outside_mapped_region",
     "source_identifier": "9NBH|1|A|A|143||A",
     "unit_id": "9NBH|1|A|A|143||A",
     "resolution": "resolved"
    },
    {
     "seq_name": "9nbh_1_A_A",
     "pdb_id": "9nbh",
     "entity_id": 1,
     "label_asym_id": "A",
     "auth_asym_id": "A",
     "label_seq_id": 144,
     "author_residue_number": 144,
     "insertion_code": "",
     "residue_name": "A",
     "alignment_state": "not_submitted_flank",
     "rfam_consensus_pos": null,
     "pp_char": "",
     "pp_value": null,
     "pp_category": null,
     "has_coordinates": true,
     "mapping_status": "outside_mapped_region",
     "source_identifier": "9NBH|1|A|A|144||A",
     "unit_id": "9NBH|1|A|A|144||A",
     "resolution": "resolved"
    },
    {
     "seq_name": "9nbh_1_C_C",
     "pdb_id": "9nbh",
     "entity_id": 1,
     "label_asym_id": "C",
     "auth_asym_id": "C",
     "label_seq_id": 141,
     "author_residue_number": 141,
     "insertion_code": "",
     "residue_name": "U",
     "alignment_state": "not_submitted_flank",
     "rfam_consensus_pos": null,
     "pp_char": "",
     "pp_value": null,
     "pp_category": null,
     "has_coordinates": true,
     "mapping_status": "outside_mapped_region",
     "source_identifier": "9NBH|1|C|U|141||A",
     "unit_id": "9NBH|1|C|U|141||A",
     "resolution": "resolved"
    },
    {
     "seq_name": "9nbh_1_C_C",
     "pdb_id": "9nbh",
     "entity_id": 1,
     "label_asym_id": "C",
     "auth_asym_id": "C",
     "label_seq_id": 142,
     "author_residue_number": 142,
     "insertion_code": "",
     "residue_name": "G",
     "alignment_state": "not_submitted_flank",
     "rfam_consensus_pos": null,
     "pp_char": "",
     "pp_value": null,
     "pp_category": null,
     "has_coordinates": true,
     "mapping_status": "outside_mapped_region",
     "source_identifier": "9NBH|1|C|G|142||A",
     "unit_id": "9NBH|1|C|G|142||A",
     "resolution": "resolved"
    },
    {
     "seq_name": "9nbh_1_C_C",
     "pdb_id": "9nbh",